{
  "$schema": "http://json-schema.org/draft-07/schema#",
  "title": "NCLEX Exam Module",
  "type": "object",
  "required": ["id", "name", "category", "questions"],
  "properties": {
    "id": {"type": "string"},
    "name": {"type": "string"},
    "category": {"type": "string"},
    "questions": {
      "type": "array",
      "items": {
        "type": "object",
        "required": ["id", "question", "answer", "rationale"],
        "properties": {
          "id": {"type": "string"},
          "slide": {"type": "integer"},
          "type": {"type": "string", "enum": ["mcq", "sata", "matrix", "bowtie", "cloze", "highlight"]},
          "question": {"type": "string", "minLength": 10},
          "options": {"type": "array", "items": {"type": "string"}, "minItems": 2},
          "rows": {"type": "array", "items": {"type": "string"}},
          "columns": {"type": "array", "items": {"type": "string"}},
          "answer": {"oneOf": [{"type": "array", "items": {"type": "integer"}}, {"type": "integer"}]},
          "rationale": {"type": "string", "minLength": 20}
        }
      }
    }
  }
}
