{
  "id": "peds_ch20_quiz",
  "name": "PEDS The Adolescent Quiz (5 Q)",
  "category": "Pediatrics",
  "questions": [
    {
      "id": "ch20_1",
      "slide": 9,
      "question": "According to the lecture (Slide 9): which is accurate?",
      "options": [
        "2 \u000bObjectives\nIdentify two ways in which a person\u2019s cultural background might contribute to behavior",
        "This applies only to adult patients.",
        "This is not a standard consideration.",
        "This is contradicted by current guidelines."
      ],
      "answer": [
        0
      ],
      "rationale": "Slide 9: 2 \u000bObjectives\nIdentify two ways in which a person\u2019s cultural background might contribute to behavior",
      "type": "mcq"
    },
    {
      "id": "ch20_2",
      "slide": 11,
      "question": "According to the lecture (Slide 11): which is accurate?",
      "options": [
        "Peer Relationships\nHelp adolescents feel like they belong\nSchool assumes important role",
        "This applies only to adult patients.",
        "This is not a standard consideration.",
        "This is contradicted by current guidelines."
      ],
      "answer": [
        0
      ],
      "rationale": "Slide 11: Peer Relationships\nHelp adolescents feel like they belong\nSchool assumes important role",
      "type": "mcq"
    },
    {
      "id": "ch20_3",
      "slide": 12,
      "question": "According to the lecture (Slide 12): which is accurate?",
      "options": [
        "Career Plans \nTo choose a career that is best-suited for them, they must first know themselves\nParents should ...",
        "This applies only to adult patients.",
        "This is not a standard consideration.",
        "This is contradicted by current guidelines."
      ],
      "answer": [
        0
      ],
      "rationale": "Slide 12: Career Plans \nTo choose a career that is best-suited for them, they must first know themselves\nParents should observe interests of their children and encourage them to take advantage of their talents",
      "type": "mcq"
    },
    {
      "id": "ch20_4",
      "slide": 14,
      "question": "According to the lecture (Slide 14): which is accurate?",
      "options": [
        "Piaget\nDevelopment is systematic, sequential, and orderly",
        "This applies only to adult patients.",
        "This is not a standard consideration.",
        "This is contradicted by current guidelines."
      ],
      "answer": [
        0
      ],
      "rationale": "Slide 14: Piaget\nDevelopment is systematic, sequential, and orderly",
      "type": "mcq"
    },
    {
      "id": "ch20_5",
      "slide": 16,
      "question": "According to the lecture (Slide 16): which is accurate?",
      "options": [
        "Daydreaming\nAdolescents spend a lot of time daydreaming in the solitude of their rooms or during a class lectu...",
        "This applies only to adult patients.",
        "This is not a standard consideration.",
        "This is contradicted by current guidelines."
      ],
      "answer": [
        0
      ],
      "rationale": "Slide 16: Daydreaming\nAdolescents spend a lot of time daydreaming in the solitude of their rooms or during a class lecture",
      "type": "mcq"
    }
  ]
}