{
  "id": "peds_ch31_quiz",
  "name": "PEDS Chapter 31 Quiz (1 Q)",
  "category": "Pediatrics",
  "questions": [
    {
      "id": "ch31_1",
      "slide": 1,
      "question": "According to the lecture (Slide 1): which is accurate?",
      "options": [
        "The Child with a \nMetabolic Condition\n\n=",
        "This applies only to adult patients.",
        "This is not a standard consideration.",
        "This is contradicted by current guidelines."
      ],
      "answer": [
        0
      ],
      "rationale": "Slide 1: The Child with a \nMetabolic Condition\n\n=",
      "type": "mcq"
    }
  ]
}