{
  "id": "peds_ch22_quiz",
  "name": "PEDS Health Care Adaptations Quiz (3 Q)",
  "category": "Pediatrics",
  "questions": [
    {
      "id": "ch22_1",
      "slide": 3,
      "question": "According to the lecture (Slide 3): which is accurate?",
      "options": [
        "Admission to the Pediatric Unit \u2013 \nNursing Responsibilities \n\n\n=",
        "This applies only to adult patients.",
        "This is not a standard consideration.",
        "This is contradicted by current guidelines."
      ],
      "answer": [
        0
      ],
      "rationale": "Slide 3: Admission to the Pediatric Unit \u2013 \nNursing Responsibilities \n\n\n=",
      "type": "mcq"
    },
    {
      "id": "ch22_2",
      "slide": 6,
      "question": "According to the lecture (Slide 6): which is accurate?",
      "options": [
        "Obtain lab requisitions, correct containers, and supplies",
        "This applies only to adult patients.",
        "This is not a standard consideration.",
        "This is contradicted by current guidelines."
      ],
      "answer": [
        0
      ],
      "rationale": "Slide 6: Obtain lab requisitions, correct containers, and supplies",
      "type": "mcq"
    },
    {
      "id": "ch22_3",
      "slide": 9,
      "question": "According to the lecture (Slide 9): which is accurate?",
      "options": [
        "Nursing Responsibilities in Administering Medications to Infants and Children\n9\n\nObserve for toxic symptoms",
        "This applies only to adult patients.",
        "This is not a standard consideration.",
        "This is contradicted by current guidelines."
      ],
      "answer": [
        0
      ],
      "rationale": "Slide 9: Nursing Responsibilities in Administering Medications to Infants and Children\n9\n\nObserve for toxic symptoms",
      "type": "mcq"
    }
  ]
}